{
  "benchmark_id": "task-001-small-v1",
  "comparability": "direct",
  "inference": {
    "inference_peak_rss_bytes": 299253760,
    "inference_wall_seconds": 0.028172206599265337,
    "raw_timing_seconds": [
      0.0035188328474760056,
      0.0034944999497383833,
      0.003542790887877345,
      0.00352808297611773,
      0.0034965830855071545,
      0.0035574999637901783,
      0.003492125077173114,
      0.0035417918115854263
    ],
    "throughput_events_per_second": 1163132.177259218,
    "timed_sequences": 512,
    "warmup_sequences": 64
  },
  "model": {
    "recurrent_state_bytes": 64,
    "recurrent_state_elements": 16,
    "total_parameters": 593,
    "trainable_parameters": 593
  },
  "quality": {
    "accuracy": 1.0,
    "balanced_accuracy": 1.0,
    "binary_cross_entropy": 0.0004909108974970877,
    "evaluated_tokens": 28672,
    "probability_clipping": "[1e-7, 1-1e-7] after sigmoid"
  },
  "recorded_at": "2026-09-13T12:25:02Z",
  "reference": {
    "name": "last-event-reference-v1",
    "quality": {
      "accuracy": 0.4990234375,
      "balanced_accuracy": 0.499016838084112,
      "binary_cross_entropy": 0.814238429069519,
      "evaluated_tokens": 28672,
      "probability_clipping": "[1e-7, 1-1e-7] after sigmoid"
    }
  },
  "seed": 101,
  "status": "completed",
  "training": {
    "epochs_completed": 20,
    "optimizer_steps": 640,
    "training_peak_rss_bytes": 299253760,
    "training_wall_seconds": 5.446592542110011
  },
  "validation_selection": {
    "selected_epoch": 20,
    "selected_validation_binary_cross_entropy": 0.0004991737077943981
  }
}
